{"counts":{"canonical":5,"context":0,"total":5,"unknown_date":0,"unlinked":0},"events":[{"aliases":["Archaeological Site of Mehrgarh","泥砖","聚落"],"body":[],"categories":["科技","文化"],"citations":[],"civilizations":[],"content_notice":"此来源全文暂未公开，可通过来源链接继续阅读。","content_status":"source_backed_draft","entry_kind":"canonical","history_scope":"world","id":"EV-bf2f7311a77f802426eb3684","images":[],"map_reference":null,"notes":[],"people":[],"places":[],"polities":[],"record_id":"REC-bf2f7311a77f802426eb3684","record_type":"period","relations":[],"review_status":"pending","revision_id":"REV-b25b27d52069608169ed592b","summary":"梅赫尔格尔的考古序列跨公元前第七至第三千纪，多代泥砖建筑叠压，逐渐形成聚落土丘。","time":{"approximate":false,"display":"公元前第七至第三千纪","end_year":-2001,"kind":"duration","precision":"period","start_year":-7000},"title":"梅赫尔格尔群体连续营建泥砖聚落"},{"aliases":["Xinglongwa and Zhaobaogou spindle whorls","纺织","纺轮"],"body":[],"categories":["科技","文化"],"citations":[],"civilizations":[],"content_notice":null,"content_status":"source_backed_draft","entry_kind":"canonical","history_scope":"china","id":"EV-a95423997412903ea4cf6ebe","images":[],"map_reference":null,"notes":[],"people":[],"places":[],"polities":[],"record_id":"REC-a95423997412903ea4cf6ebe","record_type":"period","relations":[],"review_status":"pending","revision_id":"REV-4ecb089564fbbf2dfb731a66","summary":"西辽河流域在兴隆洼时期已有纺轮，赵宝沟时期继续使用；其文化分期约从前6200年至前4500年。","time":{"approximate":true,"display":"约公元前6200—前4500年","end_year":-4500,"kind":"duration","precision":"year_range","start_year":-6200},"title":"兴隆洼至赵宝沟时期的纺轮使用"},{"aliases":["Early Plains Archaic","食物","环境适应"],"body":[],"categories":["文化","科技"],"citations":[],"civilizations":["北美大平原"],"content_notice":null,"content_status":"source_backed_draft","entry_kind":"canonical","history_scope":"world","id":"EV-4070732f6deb2a7d3d2c2708","images":[],"map_reference":null,"notes":[],"people":[],"places":[],"polities":[],"record_id":"REC-4070732f6deb2a7d3d2c2708","record_type":"period","relations":[],"review_status":"pending","revision_id":"REV-4b961f9525f946f7f3adf447","summary":"这一时期的大平原群体仍主要依靠野牛，同时增加对鱼类、鸟类和浆果的利用。","time":{"approximate":true,"display":"约公元前5600年—公元前3000年","end_year":-3000,"kind":"duration","precision":"period","start_year":-5600},"title":"北美大平原早期古风时期的食物利用"},{"aliases":["The Ubaid Period (5500–4000 B.C.)","灌溉","聚落"],"body":[],"categories":["文化","科技"],"citations":[],"civilizations":["两河流域"],"content_notice":"此来源全文暂未公开，可通过来源链接继续阅读。","content_status":"source_backed_draft","entry_kind":"canonical","history_scope":"world","id":"EV-716ecc9c02fe599e72ce3b0b","images":[],"map_reference":null,"notes":[],"people":[],"places":[],"polities":[],"record_id":"REC-716ecc9c02fe599e72ce3b0b","record_type":"period","relations":[],"review_status":"pending","revision_id":"REV-f0f089763a31f43052485020","summary":"约前5500至前4000年的乌拜德文化阶段，两河居民从事灌溉耕作，一些村落逐渐形成城镇。","time":{"approximate":true,"display":"约公元前5500—前4000年","end_year":-4000,"kind":"duration","precision":"period","start_year":-5500},"title":"乌拜德村落实行灌溉农业并出现城镇聚落"},{"aliases":["Chinchorro","丧葬","遗体处理"],"body":[],"categories":["宗教","科技"],"citations":[],"civilizations":["钦乔罗文化"],"content_notice":null,"content_status":"source_backed_draft","entry_kind":"canonical","history_scope":"world","id":"EV-6abcf6ce3331b30f63ffec6d","images":[],"map_reference":null,"notes":[],"people":[],"places":[],"polities":[],"record_id":"REC-6abcf6ce3331b30f63ffec6d","record_type":"period","relations":[],"review_status":"pending","revision_id":"REV-65713a75a23401bbbfe4b047","summary":"钦乔罗海洋狩猎采集群体的文化阶段约前5450至前890年，其复杂葬俗包含人工木乃伊制作。","time":{"approximate":true,"display":"约公元前5450—前890年","end_year":-890,"kind":"duration","precision":"period","start_year":-5450},"title":"钦乔罗海洋采集群体发展人工木乃伊葬俗"}],"revision":"97afe68b0efaaefd8288dd4827e5691d8e79754052ab8f2ad75532a627eddbfc","schema_version":"1.0.0","scope":"public_database","sources":[],"time_bounds":{"max_year":2026,"min_year":-10000}}