{"counts":{"canonical":6,"context":0,"total":6,"unknown_date":0,"unlinked":0},"events":[{"aliases":["Archaeological Site of Mehrgarh","泥砖","聚落"],"body":[],"categories":["科技","文化"],"citations":[],"civilizations":[],"content_notice":"此来源全文暂未公开，可通过来源链接继续阅读。","content_status":"source_backed_draft","entry_kind":"canonical","history_scope":"world","id":"EV-bf2f7311a77f802426eb3684","images":[],"map_reference":null,"notes":[],"people":[],"places":[],"polities":[],"record_id":"REC-bf2f7311a77f802426eb3684","record_type":"period","relations":[],"review_status":"pending","revision_id":"REV-b25b27d52069608169ed592b","summary":"梅赫尔格尔的考古序列跨公元前第七至第三千纪，多代泥砖建筑叠压，逐渐形成聚落土丘。","time":{"approximate":false,"display":"公元前第七至第三千纪","end_year":-2001,"kind":"duration","precision":"period","start_year":-7000},"title":"梅赫尔格尔群体连续营建泥砖聚落"},{"aliases":["Jade Cicada","玉器","动物造型"],"body":[],"categories":["艺术","科技"],"citations":[],"civilizations":[],"content_notice":"此来源全文暂未公开，可通过来源链接继续阅读。","content_status":"source_backed_draft","entry_kind":"canonical","history_scope":"china","id":"EV-211088c80e4a5ffd37c64cf3","images":[],"map_reference":null,"notes":[],"people":[],"places":[],"polities":[],"record_id":"REC-211088c80e4a5ffd37c64cf3","record_type":"work","relations":[],"review_status":"pending","revision_id":"REV-bc7eaed4c03c2fabfd6fbb3e","summary":"兴隆洼文化制玉者雕制蝉形玉器；国博目录将其置于约前6200至前5400年的文化范围，无法指定单一制作年。","time":{"approximate":true,"display":"约公元前6200—前5400年","end_year":-5400,"kind":"dating_range","precision":"year_range","start_year":-6200},"title":"兴隆洼文化玉蝉"},{"aliases":["Xinglongwa and Zhaobaogou spindle whorls","纺织","纺轮"],"body":[],"categories":["科技","文化"],"citations":[],"civilizations":[],"content_notice":null,"content_status":"source_backed_draft","entry_kind":"canonical","history_scope":"china","id":"EV-a95423997412903ea4cf6ebe","images":[],"map_reference":null,"notes":[],"people":[],"places":[],"polities":[],"record_id":"REC-a95423997412903ea4cf6ebe","record_type":"period","relations":[],"review_status":"pending","revision_id":"REV-4ecb089564fbbf2dfb731a66","summary":"西辽河流域在兴隆洼时期已有纺轮，赵宝沟时期继续使用；其文化分期约从前6200年至前4500年。","time":{"approximate":true,"display":"约公元前6200—前4500年","end_year":-4500,"kind":"duration","precision":"year_range","start_year":-6200},"title":"兴隆洼至赵宝沟时期的纺轮使用"},{"aliases":["Neolithic Site of Çatalhöyük - UNESCO World Heritage Centre","史前聚落"],"body":[],"categories":["文化"],"citations":[],"civilizations":["安纳托利亚"],"content_notice":null,"content_status":"source_backed_draft","entry_kind":"canonical","history_scope":"world","id":"EV-abeac2e462816082feeec3a2","images":[],"map_reference":null,"notes":[],"people":[],"places":[],"polities":[],"record_id":"REC-abeac2e462816082feeec3a2","record_type":"period","relations":[],"review_status":"pending","revision_id":"REV-f900fc24cc4f64380a499809","summary":"前6200至前5200年，加泰土丘西丘留下铜石并用时代的文化遗存；这是一段时期材料，不对应单次建城年。","time":{"approximate":true,"display":"约公元前6200—前5200年","end_year":-5200,"kind":"duration","precision":"period","start_year":-6200},"title":"加泰土丘西丘的铜石并用时代文化实践"},{"aliases":["Halaf culture","陶器","植物纹样"],"body":[],"categories":["艺术","文化"],"citations":[],"civilizations":["北部两河流域哈拉夫文化"],"content_notice":null,"content_status":"source_backed_draft","entry_kind":"canonical","history_scope":"world","id":"EV-95029cdc61d6831e98065532","images":[],"map_reference":null,"notes":[],"people":[],"places":[],"polities":[],"record_id":"REC-95029cdc61d6831e98065532","record_type":"period","relations":[],"review_status":"pending","revision_id":"REV-af9b2b91d2b0a0d3ec1873cc","summary":"约前6100至前5100年的哈拉夫文化中，陶工将植物纹样绘于彩陶，留下史前装饰艺术材料。","time":{"approximate":true,"display":"约公元前6100—前5100年","end_year":-5100,"kind":"dating_range","precision":"period","start_year":-6100},"title":"哈拉夫文化陶工在彩陶上绘制植物纹样"},{"aliases":["Early Plains Archaic","食物","环境适应"],"body":[],"categories":["文化","科技"],"citations":[],"civilizations":["北美大平原"],"content_notice":null,"content_status":"source_backed_draft","entry_kind":"canonical","history_scope":"world","id":"EV-4070732f6deb2a7d3d2c2708","images":[],"map_reference":null,"notes":[],"people":[],"places":[],"polities":[],"record_id":"REC-4070732f6deb2a7d3d2c2708","record_type":"period","relations":[],"review_status":"pending","revision_id":"REV-4b961f9525f946f7f3adf447","summary":"这一时期的大平原群体仍主要依靠野牛，同时增加对鱼类、鸟类和浆果的利用。","time":{"approximate":true,"display":"约公元前5600年—公元前3000年","end_year":-3000,"kind":"duration","precision":"period","start_year":-5600},"title":"北美大平原早期古风时期的食物利用"}],"revision":"c85df265acfdd040d1975367cc28f74268c04536e489670150a2e09533e7828c","schema_version":"1.0.0","scope":"public_database","sources":[],"time_bounds":{"max_year":2026,"min_year":-10000}}