{"counts":{"canonical":3,"context":0,"total":3,"unknown_date":0,"unlinked":0},"events":[{"aliases":["Vedic Age","历史分期","宗教传统"],"body":[],"categories":["宗教","文化"],"citations":[],"civilizations":["吠陀文化"],"content_notice":null,"content_status":"source_backed_draft","entry_kind":"canonical","history_scope":"world","id":"EV-ee7656bf5f7b0fb5c6ea2f61","images":[],"map_reference":null,"notes":[],"people":[],"places":[],"polities":[],"record_id":"REC-ee7656bf5f7b0fb5c6ea2f61","record_type":"period","relations":[],"review_status":"pending","revision_id":"REV-6d7a5b6226e057391b5f89d6","summary":"来源将人群互动形成的这一历史阶段称为吠陀时代，时间约为前1700至前600年。","time":{"approximate":true,"display":"约公元前1700年—公元前600年","end_year":-600,"kind":"duration","precision":"period","start_year":-1700},"title":"南亚吠陀时代"},{"aliases":["Upanishads","思想史","经典"],"body":[],"categories":["宗教","文化"],"citations":[],"civilizations":["古代南亚"],"content_notice":null,"content_status":"source_backed_draft","entry_kind":"canonical","history_scope":"world","id":"EV-43e3d33cd4242d9bc70a3287","images":[],"map_reference":null,"notes":[],"people":[],"places":[],"polities":[],"record_id":"REC-43e3d33cd4242d9bc70a3287","record_type":"period","relations":[],"review_status":"pending","revision_id":"REV-4ac9d28caab54d127b18c5ec","summary":"来源把《奥义书》的主要形成阶段约置于前700至前300年，记录贤哲与学生的对话和思考。","time":{"approximate":true,"display":"约公元前700年—公元前300年","end_year":-300,"kind":"duration","precision":"period","start_year":-700},"title":"《奥义书》思想文本的形成"},{"aliases":["Nineveh","战争","帝国衰亡"],"body":[],"categories":["政治"],"citations":[],"civilizations":["新亚述"],"content_notice":null,"content_status":"source_backed_draft","entry_kind":"canonical","history_scope":"world","id":"EV-1c3550419f6f03b9e80ac6f7","images":[],"map_reference":null,"notes":[],"people":[],"places":[{"coordinates":null,"label":"Nineveh","precision":"named_place","role":"source_mentioned_place"}],"polities":[],"record_id":"REC-1c3550419f6f03b9e80ac6f7","record_type":"event","relations":[],"review_status":"pending","revision_id":"REV-fce258b97145b0c5ca1209b2","summary":"来源将尼尼微于前612年被征服视作亚述帝国崩溃的节点；选段没有逐一列出攻城联盟。","time":{"approximate":false,"display":"公元前612年","end_year":-612,"kind":"point","precision":"year","start_year":-612},"title":"尼尼微被攻陷"}],"revision":"94ffc1be3b2789670cf56e3c2c45d7ba9c8d3cbfa878092514f1251106da7b47","schema_version":"1.0.0","scope":"public_database","sources":[],"time_bounds":{"max_year":2026,"min_year":-10000}}