{"counts":{"canonical":4,"context":0,"total":4,"unknown_date":0,"unlinked":0},"events":[{"aliases":["Vedic Age","历史分期","宗教传统"],"body":[],"categories":["宗教","文化"],"citations":[],"civilizations":["吠陀文化"],"content_notice":null,"content_status":"source_backed_draft","entry_kind":"canonical","history_scope":"world","id":"EV-ee7656bf5f7b0fb5c6ea2f61","images":[],"map_reference":null,"notes":[],"people":[],"places":[],"polities":[],"record_id":"REC-ee7656bf5f7b0fb5c6ea2f61","record_type":"period","relations":[],"review_status":"pending","revision_id":"REV-6d7a5b6226e057391b5f89d6","summary":"来源将人群互动形成的这一历史阶段称为吠陀时代，时间约为前1700至前600年。","time":{"approximate":true,"display":"约公元前1700年—公元前600年","end_year":-600,"kind":"duration","precision":"period","start_year":-1700},"title":"南亚吠陀时代"},{"aliases":["Upanishads","思想史","经典"],"body":[],"categories":["宗教","文化"],"citations":[],"civilizations":["古代南亚"],"content_notice":null,"content_status":"source_backed_draft","entry_kind":"canonical","history_scope":"world","id":"EV-43e3d33cd4242d9bc70a3287","images":[],"map_reference":null,"notes":[],"people":[],"places":[],"polities":[],"record_id":"REC-43e3d33cd4242d9bc70a3287","record_type":"period","relations":[],"review_status":"pending","revision_id":"REV-4ac9d28caab54d127b18c5ec","summary":"来源把《奥义书》的主要形成阶段约置于前700至前300年，记录贤哲与学生的对话和思考。","time":{"approximate":true,"display":"约公元前700年—公元前300年","end_year":-300,"kind":"duration","precision":"period","start_year":-700},"title":"《奥义书》思想文本的形成"},{"aliases":["Siddhartha Gautama","佛教","思想史"],"body":[],"categories":["宗教","人物"],"citations":[],"civilizations":["古代南亚"],"content_notice":null,"content_status":"source_backed_draft","entry_kind":"canonical","history_scope":"world","id":"EV-c65074084e713808969709ce","images":[],"map_reference":null,"notes":[],"people":[],"places":[],"polities":[],"record_id":"REC-c65074084e713808969709ce","record_type":"person","relations":[],"review_status":"pending","revision_id":"REV-c7b4884b3de86e1e14850883","summary":"来源以约前563至前480年记佛陀生平，并将他描述为突破传统婆罗门教思想的代表。","time":{"approximate":true,"display":"约公元前563年—公元前480年","end_year":-480,"kind":"duration","precision":"year_range","start_year":-563},"title":"悉达多·乔达摩与佛教思想"},{"aliases":["Confucius","思想史","教育"],"body":[],"categories":["文化","人物"],"citations":[],"civilizations":["东周"],"content_notice":null,"content_status":"source_backed_draft","entry_kind":"canonical","history_scope":"china","id":"EV-397ae776785bf3764c1e3d1e","images":[],"map_reference":null,"notes":[],"people":[],"places":[],"polities":[],"record_id":"REC-397ae776785bf3764c1e3d1e","record_type":"person","relations":[],"review_status":"pending","revision_id":"REV-0a060cce208906aa9fc13d14","summary":"来源记孔子生活于前551至前479年；其与学生的谈话在去世后编为《论语》。","time":{"approximate":false,"display":"公元前551年—公元前479年","end_year":-479,"kind":"duration","precision":"year_range","start_year":-551},"title":"孔子的思想活动与《论语》传承"}],"revision":"9a47a03f7a96bcdde8137ecfb22ea63e9617ad0c813b925ca046d75c268d67c8","schema_version":"1.0.0","scope":"public_database","sources":[],"time_bounds":{"max_year":2026,"min_year":-10000}}