{"counts":{"canonical":13,"context":0,"total":13,"unknown_date":0,"unlinked":0},"events":[{"aliases":["Chinchorro","丧葬","遗体处理"],"body":[],"categories":["宗教","科技"],"citations":[],"civilizations":["钦乔罗文化"],"content_notice":null,"content_status":"source_backed_draft","entry_kind":"canonical","history_scope":"world","id":"EV-6abcf6ce3331b30f63ffec6d","images":[],"map_reference":null,"notes":[],"people":[],"places":[],"polities":[],"record_id":"REC-6abcf6ce3331b30f63ffec6d","record_type":"period","relations":[],"review_status":"pending","revision_id":"REV-65713a75a23401bbbfe4b047","summary":"钦乔罗海洋狩猎采集群体的文化阶段约前5450至前890年，其复杂葬俗包含人工木乃伊制作。","time":{"approximate":true,"display":"约公元前5450—前890年","end_year":-890,"kind":"duration","precision":"period","start_year":-5450},"title":"钦乔罗海洋采集群体发展人工木乃伊葬俗"},{"aliases":["Prehistoric Pile Dwellings around the Alps","居住建筑","环境利用"],"body":[],"categories":["科技","文化"],"citations":[],"civilizations":[],"content_notice":null,"content_status":"source_backed_draft","entry_kind":"canonical","history_scope":"world","id":"EV-a536f3f65d5c123aab2dee06","images":[],"map_reference":null,"notes":[],"people":[],"places":[],"polities":[],"record_id":"REC-a536f3f65d5c123aab2dee06","record_type":"period","relations":[],"review_status":"pending","revision_id":"REV-f906208a1b8c8be006163506","summary":"约前5000至前500年，阿尔卑斯及周边群体在湖泊、河流和湿地边缘营建桩上居住聚落。","time":{"approximate":true,"display":"约公元前5000—前500年","end_year":-500,"kind":"duration","precision":"period","start_year":-5000},"title":"阿尔卑斯周边群体营建水边桩上聚落"},{"aliases":["The Neolithic Settlement of Burzahom","居住建筑","生活史"],"body":[],"categories":["科技","文化"],"citations":[],"civilizations":[],"content_notice":"此来源全文暂未公开，可通过来源链接继续阅读。","content_status":"source_backed_draft","entry_kind":"canonical","history_scope":"world","id":"EV-a931b99a7f349b23461c292e","images":[],"map_reference":null,"notes":[],"people":[],"places":[],"polities":[],"record_id":"REC-a931b99a7f349b23461c292e","record_type":"period","relations":[],"review_status":"pending","revision_id":"REV-dfac75ac51b5c9262b0045cb","summary":"布尔扎霍姆约前3000至前1000年的遗存显示，早期群体的住屋从地下坑穴逐渐转为地面泥砖建筑。","time":{"approximate":true,"display":"约公元前3000—前1000年","end_year":-1000,"kind":"duration","precision":"period","start_year":-3000},"title":"布尔扎霍姆群体由坑穴住居转向地面泥砖建筑"},{"aliases":["Lower Xiajiadian walled settlements","城墙","聚落","建筑材料"],"body":[],"categories":["科技","政治"],"citations":[],"civilizations":[],"content_notice":null,"content_status":"source_backed_draft","entry_kind":"canonical","history_scope":"china","id":"EV-d9b5514d71acca6488d46bc4","images":[],"map_reference":null,"notes":[],"people":[],"places":[],"polities":[],"record_id":"REC-d9b5514d71acca6488d46bc4","record_type":"period","relations":[],"review_status":"pending","revision_id":"REV-6fcd73b54cef4358be0add01","summary":"夏家店下层文化居民营建土筑和石筑聚落；研究模型显示，建材与空间分布的明显变化大体发生在前1500年后。","time":{"approximate":true,"display":"约公元前2000—前1300年","end_year":-1300,"kind":"duration","precision":"year_range","start_year":-2000},"title":"夏家店下层文化的土城与石城"},{"aliases":["Vedic Age","历史分期","宗教传统"],"body":[],"categories":["宗教","文化"],"citations":[],"civilizations":["吠陀文化"],"content_notice":null,"content_status":"source_backed_draft","entry_kind":"canonical","history_scope":"world","id":"EV-ee7656bf5f7b0fb5c6ea2f61","images":[],"map_reference":null,"notes":[],"people":[],"places":[],"polities":[],"record_id":"REC-ee7656bf5f7b0fb5c6ea2f61","record_type":"period","relations":[],"review_status":"pending","revision_id":"REV-6d7a5b6226e057391b5f89d6","summary":"来源将人群互动形成的这一历史阶段称为吠陀时代，时间约为前1700至前600年。","time":{"approximate":true,"display":"约公元前1700年—公元前600年","end_year":-600,"kind":"duration","precision":"period","start_year":-1700},"title":"南亚吠陀时代"},{"aliases":["Poverty Point","土方工程","聚落"],"body":[],"categories":["文化","宗教"],"citations":[],"civilizations":[],"content_notice":"此来源全文暂未公开，可通过来源链接继续阅读。","content_status":"source_backed_draft","entry_kind":"canonical","history_scope":"world","id":"EV-24e378dd0db2af339a694e5c","images":[],"map_reference":null,"notes":[],"people":[],"places":[],"polities":[],"record_id":"REC-24e378dd0db2af339a694e5c","record_type":"period","relations":[],"review_status":"pending","revision_id":"REV-eb7702de2dc87b92974c5b39","summary":"庞蒂岬的狩猎、捕鱼和采集群体在约前1700至前1100年间营建并使用遗址，兼具居住和仪式功能。","time":{"approximate":true,"display":"约公元前1700—前1100年","end_year":-1100,"kind":"duration","precision":"period","start_year":-1700},"title":"庞蒂岬群体营建居住与仪式场所"},{"aliases":["Shang Dynasty","文字","早期王朝"],"body":[],"categories":["政治","文化"],"citations":[],"civilizations":["商"],"content_notice":null,"content_status":"source_backed_draft","entry_kind":"canonical","history_scope":"china","id":"EV-b41382293c427605b9ce9c4a","images":[],"map_reference":null,"notes":[],"people":[],"places":[],"polities":[],"record_id":"REC-b41382293c427605b9ce9c4a","record_type":"period","relations":[],"review_status":"pending","revision_id":"REV-aded09682f12b941d7a10e6e","summary":"商代是中国早期王朝史的重要阶段；甲骨文字是来源用于解释这一时期历史的主要材料。","time":{"approximate":true,"display":"约公元前1600年—公元前1046年","end_year":-1046,"kind":"duration","precision":"period","start_year":-1600},"title":"商代与甲骨文字材料"},{"aliases":["Vedas","口传","经典"],"body":[],"categories":["宗教","文化"],"citations":[],"civilizations":["古代南亚吠陀文化"],"content_notice":null,"content_status":"source_backed_draft","entry_kind":"canonical","history_scope":"world","id":"EV-56d42ab06d7fea906291cccd","images":[],"map_reference":null,"notes":[],"people":[],"places":[],"polities":[],"record_id":"REC-56d42ab06d7fea906291cccd","record_type":"period","relations":[],"review_status":"pending","revision_id":"REV-de04c496174a4b728314628a","summary":"来源把吠陀宗教文本的形成约置于前1500至前900年，强调这一传统属于吠陀人群的文化。","time":{"approximate":true,"display":"约公元前1500年—公元前900年","end_year":-900,"kind":"duration","precision":"period","start_year":-1500},"title":"吠陀文本的口传形成阶段"},{"aliases":["Lapita","航海","迁徙"],"body":[],"categories":["文化","科技"],"citations":[],"civilizations":["拉皮塔文化"],"content_notice":"此来源全文暂未公开，可通过来源链接继续阅读。","content_status":"source_backed_draft","entry_kind":"canonical","history_scope":"world","id":"EV-52fbdf753d3de83af6df1c85","images":[],"map_reference":null,"notes":[],"people":[],"places":[],"polities":[],"record_id":"REC-52fbdf753d3de83af6df1c85","record_type":"period","relations":[],"review_status":"pending","revision_id":"REV-e21bb85d4eea84d1ce00bcad","summary":"约前1500年起，拉皮塔人群向东扩展，约前1000年到达汤加和萨摩亚，体现远洋迁徙阶段。","time":{"approximate":true,"display":"约公元前1500—前1000年","end_year":-1000,"kind":"duration","precision":"period","start_year":-1500},"title":"拉皮塔人群向汤加与萨摩亚扩展"},{"aliases":["Chavin (Archaeological Site)","祭祀建筑","石构工程"],"body":[],"categories":["宗教","艺术"],"citations":[],"civilizations":["查文文化"],"content_notice":null,"content_status":"source_backed_draft","entry_kind":"canonical","history_scope":"world","id":"EV-280b5328278768f1896e83d1","images":[],"map_reference":null,"notes":[],"people":[],"places":[],"polities":[],"record_id":"REC-280b5328278768f1896e83d1","record_type":"period","relations":[],"review_status":"pending","revision_id":"REV-49a633c3583c898708b6ea16","summary":"查文文化约在前1500至前300年发展，其祭祀遗址由台地、广场及周围石砌建筑组成。","time":{"approximate":true,"display":"约公元前1500—前300年","end_year":-300,"kind":"duration","precision":"period","start_year":-1500},"title":"查文文化营建石构祭祀建筑"},{"aliases":["Panlongcheng","城市","青铜","区域联系"],"body":[],"categories":["政治","文化","科技"],"citations":[],"civilizations":[],"content_notice":null,"content_status":"source_backed_draft","entry_kind":"canonical","history_scope":"china","id":"EV-48405d68600789c63656f7d6","images":[],"map_reference":null,"notes":[],"people":[],"places":[],"polities":[],"record_id":"REC-48405d68600789c63656f7d6","record_type":"site","relations":[],"review_status":"pending","revision_id":"REV-ab690e9935a0aaec64c9a848","summary":"盘龙城居民营建有围墙的聚落；论文采用约前1500至前1300年的遗址年代，不能据此指定单一始建年。","time":{"approximate":true,"display":"约公元前1500—前1300年","end_year":-1300,"kind":"duration","precision":"year_range","start_year":-1500},"title":"盘龙城的城墙聚落"},{"aliases":["San José Mogote","公共建筑","聚落"],"body":[],"categories":["科技","文化"],"citations":[],"civilizations":[],"content_notice":"此来源全文暂未公开，可通过来源链接继续阅读。","content_status":"source_backed_draft","entry_kind":"canonical","history_scope":"world","id":"EV-e275f46350790541dc6d66d0","images":[],"map_reference":null,"notes":[],"people":[],"places":[],"polities":[],"record_id":"REC-e275f46350790541dc6d66d0","record_type":"period","relations":[],"review_status":"pending","revision_id":"REV-b90c55043cc7ab604fa28625","summary":"约前1350年，圣何塞莫戈特群体在平台状基础上营建公共建筑，具体建造年份尚未确定。","time":{"approximate":true,"display":"约公元前1350年","end_year":-1350,"kind":"point","precision":"year","start_year":-1350},"title":"圣何塞莫戈特群体营建平台上的公共建筑"},{"aliases":["Amarna","都城","营建"],"body":[],"categories":["政治","宗教","艺术"],"citations":[],"civilizations":["埃及第十八王朝"],"content_notice":null,"content_status":"source_backed_draft","entry_kind":"canonical","history_scope":"world","id":"EV-30d10da938ccce99248ee4da","images":[],"map_reference":null,"notes":[],"people":[],"places":[],"polities":[],"record_id":"REC-30d10da938ccce99248ee4da","record_type":"event","relations":[],"review_status":"pending","revision_id":"REV-c78391fc59bd3aa99620604e","summary":"阿肯那顿在位第五年前后开始营建阿赫塔顿新都；所读来源对应约前1346年，不以此代替全城竣工年。","time":{"approximate":true,"display":"约公元前1346年","end_year":-1346,"kind":"point","precision":"year","start_year":-1346},"title":"阿肯那顿营建新都阿赫塔顿"}],"revision":"f6a7f6cd840abffb6be77950e5b7e720ff888cc2740038bb95dbcd445de24d17","schema_version":"1.0.0","scope":"public_database","sources":[],"time_bounds":{"max_year":2026,"min_year":-10000}}