{"counts":{"canonical":4,"context":0,"total":4,"unknown_date":0,"unlinked":0},"events":[{"aliases":["良渚古城遗址","考古","城市","农业"],"body":[],"categories":["文化","科技"],"citations":[],"civilizations":["长江下游良渚文化"],"content_notice":null,"content_status":"source_backed_draft","entry_kind":"canonical","history_scope":"china","id":"EV-93b17d91c328ecf3effb809c","images":[],"map_reference":null,"notes":[],"people":[],"places":[],"polities":[],"record_id":"REC-93b17d91c328ecf3effb809c","record_type":"site","relations":[],"review_status":"pending","revision_id":"REV-ee16c6a8e02287bb80c799fe","summary":"良渚古城遗址展现约前3300至前2300年的稻作社会，拥有城市规划、水利系统及不同等级墓葬。","time":{"approximate":true,"display":"约公元前3300年—公元前2300年","end_year":-2300,"kind":"duration","precision":"year_range","start_year":-3300},"title":"良渚古城及其稻作社会"},{"aliases":["Longshan culture","聚落考古"],"body":[],"categories":["文化","政治"],"citations":[],"civilizations":["龙山文化"],"content_notice":null,"content_status":"source_backed_draft","entry_kind":"canonical","history_scope":"china","id":"EV-80a36b77f8ccd40098f1c334","images":[],"map_reference":null,"notes":[],"people":[],"places":[],"polities":[],"record_id":"REC-80a36b77f8ccd40098f1c334","record_type":"period","relations":[],"review_status":"pending","revision_id":"REV-8b94b1b2e8f9e1e8b681717e","summary":"龙山文化在黄河中下游兴起；来源所述遗存包括多处有城墙的城镇和城外墓地。","time":{"approximate":true,"display":"约公元前3000年—公元前1900年","end_year":-1900,"kind":"duration","precision":"period","start_year":-3000},"title":"龙山文化的城墙与墓地"},{"aliases":["Old Kingdom","建筑","王权"],"body":[],"categories":["艺术","宗教"],"citations":[],"civilizations":["古埃及"],"content_notice":"此来源全文暂未公开，可通过来源链接继续阅读。","content_status":"source_backed_draft","entry_kind":"canonical","history_scope":"world","id":"EV-bef26913546db2808565f9de","images":[],"map_reference":null,"notes":[],"people":[],"places":[],"polities":[],"record_id":"REC-bef26913546db2808565f9de","record_type":"period","relations":[],"review_status":"pending","revision_id":"REV-b6ebf94181b7a33cd30fc6aa","summary":"古王国时期的法老组织金字塔营建，将其作为王室陵墓，并以建筑表达王权与神祇的关系。","time":{"approximate":true,"display":"约公元前2660年—公元前2160年","end_year":-2160,"kind":"duration","precision":"period","start_year":-2660},"title":"古王国时期的金字塔营建"},{"aliases":["Kingdom of Kerma","早期国家"],"body":[],"categories":["政治","文化"],"citations":[],"civilizations":["努比亚克尔马"],"content_notice":"此来源全文暂未公开，可通过来源链接继续阅读。","content_status":"source_backed_draft","entry_kind":"canonical","history_scope":"world","id":"EV-05f49bff097c6484e3bc0360","images":[],"map_reference":null,"notes":[],"people":[],"places":[{"coordinates":null,"label":"Nile River","precision":"named_place","role":"source_mentioned_place"}],"polities":[],"record_id":"REC-05f49bff097c6484e3bc0360","record_type":"period","relations":[],"review_status":"pending","revision_id":"REV-e1aa22bf195500513b68a937","summary":"来源将克尔马王国约定于前2400至前1500年，指出其繁盛依靠农业及当地自然资源。","time":{"approximate":true,"display":"约公元前2400年—公元前1500年","end_year":-1500,"kind":"duration","precision":"period","start_year":-2400},"title":"克尔马王国时期"}],"revision":"94ffc1be3b2789670cf56e3c2c45d7ba9c8d3cbfa878092514f1251106da7b47","schema_version":"1.0.0","scope":"public_database","sources":[],"time_bounds":{"max_year":2026,"min_year":-10000}}