{"counts":{"canonical":4,"context":0,"total":4,"unknown_date":0,"unlinked":0},"events":[{"aliases":["Kingdom of Kerma","早期国家"],"body":[],"categories":["政治","文化"],"citations":[],"civilizations":["努比亚克尔马"],"content_notice":"此来源全文暂未公开，可通过来源链接继续阅读。","content_status":"source_backed_draft","entry_kind":"canonical","history_scope":"world","id":"EV-05f49bff097c6484e3bc0360","images":[],"map_reference":null,"notes":[],"people":[],"places":[{"coordinates":null,"label":"Nile River","precision":"named_place","role":"source_mentioned_place"}],"polities":[],"record_id":"REC-05f49bff097c6484e3bc0360","record_type":"period","relations":[],"review_status":"pending","revision_id":"REV-e1aa22bf195500513b68a937","summary":"来源将克尔马王国约定于前2400至前1500年，指出其繁盛依靠农业及当地自然资源。","time":{"approximate":true,"display":"约公元前2400年—公元前1500年","end_year":-1500,"kind":"duration","precision":"period","start_year":-2400},"title":"克尔马王国时期"},{"aliases":["Vedic Age","历史分期","宗教传统"],"body":[],"categories":["宗教","文化"],"citations":[],"civilizations":["吠陀文化"],"content_notice":null,"content_status":"source_backed_draft","entry_kind":"canonical","history_scope":"world","id":"EV-ee7656bf5f7b0fb5c6ea2f61","images":[],"map_reference":null,"notes":[],"people":[],"places":[],"polities":[],"record_id":"REC-ee7656bf5f7b0fb5c6ea2f61","record_type":"period","relations":[],"review_status":"pending","revision_id":"REV-6d7a5b6226e057391b5f89d6","summary":"来源将人群互动形成的这一历史阶段称为吠陀时代，时间约为前1700至前600年。","time":{"approximate":true,"display":"约公元前1700年—公元前600年","end_year":-600,"kind":"duration","precision":"period","start_year":-1700},"title":"南亚吠陀时代"},{"aliases":["Shang Dynasty","文字","早期王朝"],"body":[],"categories":["政治","文化"],"citations":[],"civilizations":["商"],"content_notice":null,"content_status":"source_backed_draft","entry_kind":"canonical","history_scope":"china","id":"EV-b41382293c427605b9ce9c4a","images":[],"map_reference":null,"notes":[],"people":[],"places":[],"polities":[],"record_id":"REC-b41382293c427605b9ce9c4a","record_type":"period","relations":[],"review_status":"pending","revision_id":"REV-aded09682f12b941d7a10e6e","summary":"商代是中国早期王朝史的重要阶段；甲骨文字是来源用于解释这一时期历史的主要材料。","time":{"approximate":true,"display":"约公元前1600年—公元前1046年","end_year":-1046,"kind":"duration","precision":"period","start_year":-1600},"title":"商代与甲骨文字材料"},{"aliases":["Vedas","口传","经典"],"body":[],"categories":["宗教","文化"],"citations":[],"civilizations":["古代南亚吠陀文化"],"content_notice":null,"content_status":"source_backed_draft","entry_kind":"canonical","history_scope":"world","id":"EV-56d42ab06d7fea906291cccd","images":[],"map_reference":null,"notes":[],"people":[],"places":[],"polities":[],"record_id":"REC-56d42ab06d7fea906291cccd","record_type":"period","relations":[],"review_status":"pending","revision_id":"REV-de04c496174a4b728314628a","summary":"来源把吠陀宗教文本的形成约置于前1500至前900年，强调这一传统属于吠陀人群的文化。","time":{"approximate":true,"display":"约公元前1500年—公元前900年","end_year":-900,"kind":"duration","precision":"period","start_year":-1500},"title":"吠陀文本的口传形成阶段"}],"revision":"aa0a32df9f19fd07c92feaa85de5c08761068c04c3a9035518ad384f1d516ef1","schema_version":"1.0.0","scope":"public_database","sources":[],"time_bounds":{"max_year":2026,"min_year":-10000}}