{"counts":{"canonical":4,"context":0,"total":4,"unknown_date":0,"unlinked":0},"events":[{"aliases":["Early Plains Archaic","食物","环境适应"],"body":[],"categories":["文化","科技"],"citations":[],"civilizations":["北美大平原"],"content_notice":null,"content_status":"source_backed_draft","entry_kind":"canonical","history_scope":"world","id":"EV-4070732f6deb2a7d3d2c2708","images":[],"map_reference":null,"notes":[],"people":[],"places":[],"polities":[],"record_id":"REC-4070732f6deb2a7d3d2c2708","record_type":"period","relations":[],"review_status":"pending","revision_id":"REV-4b961f9525f946f7f3adf447","summary":"这一时期的大平原群体仍主要依靠野牛，同时增加对鱼类、鸟类和浆果的利用。","time":{"approximate":true,"display":"约公元前5600年—公元前3000年","end_year":-3000,"kind":"duration","precision":"period","start_year":-5600},"title":"北美大平原早期古风时期的食物利用"},{"aliases":["Nubia","环境","聚落"],"body":[],"categories":["文化","科技"],"citations":[],"civilizations":["尼罗河流域努比亚"],"content_notice":"此来源全文暂未公开，可通过来源链接继续阅读。","content_status":"source_backed_draft","entry_kind":"canonical","history_scope":"world","id":"EV-4e94e4ccd7fc655054ede8af","images":[],"map_reference":null,"notes":[],"people":[],"places":[{"coordinates":null,"label":"Nile River","precision":"named_place","role":"source_mentioned_place"}],"polities":[],"record_id":"REC-4e94e4ccd7fc655054ede8af","record_type":"period","relations":[],"review_status":"pending","revision_id":"REV-a0580ce2540fe3de6cf8a958","summary":"在环境趋于干旱的背景下，努比亚居民带着牛群和农业传统向尼罗河集中，形成较密集聚落。","time":{"approximate":true,"display":"约公元前5000年—公元前4000年","end_year":-4000,"kind":"duration","precision":"period","start_year":-5000},"title":"努比亚居民向尼罗河集中"},{"aliases":["transitional period","农业","城市起源"],"body":[],"categories":["文化","科技"],"citations":[],"civilizations":["印度河文明"],"content_notice":null,"content_status":"source_backed_draft","entry_kind":"canonical","history_scope":"world","id":"EV-acead5667bb162fd5c75046c","images":[],"map_reference":null,"notes":[],"people":[],"places":[],"polities":[],"record_id":"REC-acead5667bb162fd5c75046c","record_type":"period","relations":[],"review_status":"pending","revision_id":"REV-3c27201cb64e5235c231b728","summary":"来源把印度河成熟城市出现前的转型阶段定在前5000至前2600年，随后进入成熟阶段。","time":{"approximate":true,"display":"约公元前5000年—公元前2600年","end_year":-2600,"kind":"duration","precision":"period","start_year":-5000},"title":"印度河地区迈向城市文明"},{"aliases":["Yangshao (painted pottery) culture","考古","制陶"],"body":[],"categories":["文化","科技"],"citations":[],"civilizations":["黄河流域新石器文化"],"content_notice":null,"content_status":"source_backed_draft","entry_kind":"canonical","history_scope":"china","id":"EV-9cbeae08566b87e98af368ec","images":[],"map_reference":null,"notes":[],"people":[],"places":[],"polities":[],"record_id":"REC-9cbeae08566b87e98af368ec","record_type":"period","relations":[],"review_status":"pending","revision_id":"REV-cf376797edec3cabc529f6b7","summary":"来源将仰韶列为这一时期的区域新石器文化，并指出其主要分布于黄河中游。","time":{"approximate":true,"display":"约公元前5000年—公元前3000年","end_year":-3000,"kind":"duration","precision":"period","start_year":-5000},"title":"黄河中游的仰韶文化"}],"revision":"9a47a03f7a96bcdde8137ecfb22ea63e9617ad0c813b925ca046d75c268d67c8","schema_version":"1.0.0","scope":"public_database","sources":[],"time_bounds":{"max_year":2026,"min_year":-10000}}