{"counts":{"canonical":6,"context":0,"total":6,"unknown_date":0,"unlinked":0},"events":[{"aliases":["Early Plains Archaic","食物","环境适应"],"body":[],"categories":["文化","科技"],"citations":[],"civilizations":["北美大平原"],"content_notice":null,"content_status":"source_backed_draft","entry_kind":"canonical","history_scope":"world","id":"EV-4070732f6deb2a7d3d2c2708","images":[],"map_reference":null,"notes":[],"people":[],"places":[],"polities":[],"record_id":"REC-4070732f6deb2a7d3d2c2708","record_type":"period","relations":[],"review_status":"pending","revision_id":"REV-4b961f9525f946f7f3adf447","summary":"这一时期的大平原群体仍主要依靠野牛，同时增加对鱼类、鸟类和浆果的利用。","time":{"approximate":true,"display":"约公元前5600年—公元前3000年","end_year":-3000,"kind":"duration","precision":"period","start_year":-5600},"title":"北美大平原早期古风时期的食物利用"},{"aliases":["transitional period","农业","城市起源"],"body":[],"categories":["文化","科技"],"citations":[],"civilizations":["印度河文明"],"content_notice":null,"content_status":"source_backed_draft","entry_kind":"canonical","history_scope":"world","id":"EV-acead5667bb162fd5c75046c","images":[],"map_reference":null,"notes":[],"people":[],"places":[],"polities":[],"record_id":"REC-acead5667bb162fd5c75046c","record_type":"period","relations":[],"review_status":"pending","revision_id":"REV-3c27201cb64e5235c231b728","summary":"来源把印度河成熟城市出现前的转型阶段定在前5000至前2600年，随后进入成熟阶段。","time":{"approximate":true,"display":"约公元前5000年—公元前2600年","end_year":-2600,"kind":"duration","precision":"period","start_year":-5000},"title":"印度河地区迈向城市文明"},{"aliases":["Yangshao (painted pottery) culture","考古","制陶"],"body":[],"categories":["文化","科技"],"citations":[],"civilizations":["黄河流域新石器文化"],"content_notice":null,"content_status":"source_backed_draft","entry_kind":"canonical","history_scope":"china","id":"EV-9cbeae08566b87e98af368ec","images":[],"map_reference":null,"notes":[],"people":[],"places":[],"polities":[],"record_id":"REC-9cbeae08566b87e98af368ec","record_type":"period","relations":[],"review_status":"pending","revision_id":"REV-cf376797edec3cabc529f6b7","summary":"来源将仰韶列为这一时期的区域新石器文化，并指出其主要分布于黄河中游。","time":{"approximate":true,"display":"约公元前5000年—公元前3000年","end_year":-3000,"kind":"duration","precision":"period","start_year":-5000},"title":"黄河中游的仰韶文化"},{"aliases":["Norte Chico","灌溉","农业"],"body":[],"categories":["科技","文化"],"citations":[],"civilizations":["安第斯北奇科地区"],"content_notice":null,"content_status":"source_backed_draft","entry_kind":"canonical","history_scope":"world","id":"EV-9f5890c5322f6aac42561e18","images":[],"map_reference":null,"notes":[],"people":[],"places":[{"coordinates":null,"label":"Norte Chico","precision":"named_place","role":"source_mentioned_place"}],"polities":[],"record_id":"REC-9f5890c5322f6aac42561e18","record_type":"period","relations":[],"review_status":"pending","revision_id":"REV-7d9eda7536051e6942ab6686","summary":"来源提到前4000至前3000年间内陆修渠活动，并推测沿海劳动力可能参与了工程。","time":{"approximate":true,"display":"约公元前4000年—公元前3000年","end_year":-3000,"kind":"duration","precision":"period","start_year":-4000},"title":"安第斯沿海腹地修建水渠"},{"aliases":["良渚古城遗址","考古","城市","农业"],"body":[],"categories":["文化","科技"],"citations":[],"civilizations":["长江下游良渚文化"],"content_notice":null,"content_status":"source_backed_draft","entry_kind":"canonical","history_scope":"china","id":"EV-93b17d91c328ecf3effb809c","images":[],"map_reference":null,"notes":[],"people":[],"places":[],"polities":[],"record_id":"REC-93b17d91c328ecf3effb809c","record_type":"site","relations":[],"review_status":"pending","revision_id":"REV-ee16c6a8e02287bb80c799fe","summary":"良渚古城遗址展现约前3300至前2300年的稻作社会，拥有城市规划、水利系统及不同等级墓葬。","time":{"approximate":true,"display":"约公元前3300年—公元前2300年","end_year":-2300,"kind":"duration","precision":"year_range","start_year":-3300},"title":"良渚古城及其稻作社会"},{"aliases":["King Narmer","国家形成"],"body":[],"categories":["政治"],"citations":[],"civilizations":["古埃及"],"content_notice":"此来源全文暂未公开，可通过来源链接继续阅读。","content_status":"source_backed_draft","entry_kind":"canonical","history_scope":"world","id":"EV-814bd6c972bad65159abe47e","images":[],"map_reference":null,"notes":[],"people":[],"places":[],"polities":[],"record_id":"REC-814bd6c972bad65159abe47e","record_type":"event","relations":[],"review_status":"pending","revision_id":"REV-3e18e48e8858d558fa453c0c","summary":"来源将上下埃及统一约定于前3100年，并说明纳尔迈常被视为完成统一的君主。","time":{"approximate":true,"display":"约公元前3100年","end_year":-3100,"kind":"point","precision":"year","start_year":-3100},"title":"上下埃及走向统一"}],"revision":"aa0a32df9f19fd07c92feaa85de5c08761068c04c3a9035518ad384f1d516ef1","schema_version":"1.0.0","scope":"public_database","sources":[],"time_bounds":{"max_year":2026,"min_year":-10000}}