{"counts":{"canonical":2,"context":0,"total":2,"unknown_date":0,"unlinked":0},"events":[{"aliases":["Archaeological Site of Mehrgarh","泥砖","聚落"],"body":[],"categories":["科技","文化"],"citations":[],"civilizations":[],"content_notice":"此来源全文暂未公开，可通过来源链接继续阅读。","content_status":"source_backed_draft","entry_kind":"canonical","history_scope":"world","id":"EV-bf2f7311a77f802426eb3684","images":[],"map_reference":null,"notes":[],"people":[],"places":[],"polities":[],"record_id":"REC-bf2f7311a77f802426eb3684","record_type":"period","relations":[],"review_status":"pending","revision_id":"REV-b25b27d52069608169ed592b","summary":"梅赫尔格尔的考古序列跨公元前第七至第三千纪，多代泥砖建筑叠压，逐渐形成聚落土丘。","time":{"approximate":false,"display":"公元前第七至第三千纪","end_year":-2001,"kind":"duration","precision":"period","start_year":-7000},"title":"梅赫尔格尔群体连续营建泥砖聚落"},{"aliases":["来源未给独立事件专名；据所列遗址、器物或行动描述拟题。","音乐","骨器"],"body":[],"categories":["艺术","科技"],"citations":[],"civilizations":[],"content_notice":"此来源全文暂未公开，可通过来源链接继续阅读。","content_status":"source_backed_draft","entry_kind":"canonical","history_scope":"china","id":"EV-d11d41a96927b4f4b4dbec85","images":[],"map_reference":null,"notes":[],"people":[],"places":[],"polities":[],"record_id":"REC-d11d41a96927b4f4b4dbec85","record_type":"period","relations":[],"review_status":"pending","revision_id":"REV-5c720b1f4a01a3287cb8b626","summary":"贾湖约前7000至前5700年有人定居，出土骨笛以鹤类翼骨制作，为早期多音吹奏乐器提供材料。","time":{"approximate":true,"display":"约公元前7000—前5700年","end_year":-5700,"kind":"duration","precision":"year_range","start_year":-7000},"title":"贾湖新石器时代遗存与骨笛制作"}],"revision":"f6a7f6cd840abffb6be77950e5b7e720ff888cc2740038bb95dbcd445de24d17","schema_version":"1.0.0","scope":"public_database","sources":[],"time_bounds":{"max_year":2026,"min_year":-10000}}