{"counts":{"canonical":3,"context":0,"total":3,"unknown_date":0,"unlinked":0},"events":[{"aliases":["Longshan culture","聚落考古"],"body":[],"categories":["文化","政治"],"citations":[],"civilizations":["龙山文化"],"content_notice":null,"content_status":"source_backed_draft","entry_kind":"canonical","history_scope":"china","id":"EV-80a36b77f8ccd40098f1c334","images":[],"map_reference":null,"notes":[],"people":[],"places":[],"polities":[],"record_id":"REC-80a36b77f8ccd40098f1c334","record_type":"period","relations":[],"review_status":"pending","revision_id":"REV-8b94b1b2e8f9e1e8b681717e","summary":"龙山文化在黄河中下游兴起；来源所述遗存包括多处有城墙的城镇和城外墓地。","time":{"approximate":true,"display":"约公元前3000年—公元前1900年","end_year":-1900,"kind":"duration","precision":"period","start_year":-3000},"title":"龙山文化的城墙与墓地"},{"aliases":["Kingdom of Kerma","早期国家"],"body":[],"categories":["政治","文化"],"citations":[],"civilizations":["努比亚克尔马"],"content_notice":"此来源全文暂未公开，可通过来源链接继续阅读。","content_status":"source_backed_draft","entry_kind":"canonical","history_scope":"world","id":"EV-05f49bff097c6484e3bc0360","images":[],"map_reference":null,"notes":[],"people":[],"places":[{"coordinates":null,"label":"Nile River","precision":"named_place","role":"source_mentioned_place"}],"polities":[],"record_id":"REC-05f49bff097c6484e3bc0360","record_type":"period","relations":[],"review_status":"pending","revision_id":"REV-e1aa22bf195500513b68a937","summary":"来源将克尔马王国约定于前2400至前1500年，指出其繁盛依靠农业及当地自然资源。","time":{"approximate":true,"display":"约公元前2400年—公元前1500年","end_year":-1500,"kind":"duration","precision":"period","start_year":-2400},"title":"克尔马王国时期"},{"aliases":["Great Ziggurat","建筑","祭祀"],"body":[],"categories":["艺术","宗教"],"citations":[],"civilizations":["乌尔第三王朝"],"content_notice":null,"content_status":"source_backed_draft","entry_kind":"canonical","history_scope":"world","id":"EV-5a8f7f61302dccff762430f3","images":[],"map_reference":null,"notes":[],"people":[],"places":[],"polities":[],"record_id":"REC-5a8f7f61302dccff762430f3","record_type":"work","relations":[],"review_status":"pending","revision_id":"REV-2da385c3af420a78e68c4c2e","summary":"乌尔纳姆王约在前2100年修建乌尔大塔庙；来源描述其有三层台基，顶部设神庙。","time":{"approximate":true,"display":"约公元前2100年","end_year":-2100,"kind":"point","precision":"year","start_year":-2100},"title":"乌尔纳姆修建乌尔大塔庙"}],"revision":"aa0a32df9f19fd07c92feaa85de5c08761068c04c3a9035518ad384f1d516ef1","schema_version":"1.0.0","scope":"public_database","sources":[],"time_bounds":{"max_year":2026,"min_year":-10000}}